{
  "mechanism_id": "m012",
  "scope": "v0_reference_replay",
  "as_of": "2026-02-18T12:00:00Z",
  "config": {
    "hard_cap": "221000000000000",
    "r_base": 0.02,
    "ecological_multiplier": 1.0,
    "ecological_multiplier_enabled": false
  },
  "periods": [
    {
      "period": 0,
      "timestamp": "2026-01-06T00:00:00Z",
      "supply_state": {
        "current_supply": "150000000000000",
        "staked_amount": "75000000000000",
        "stability_committed": "0",
        "m014_state": "INACTIVE",
        "ecological_multiplier_enabled": false
      },
      "burn_amount": "500000000000"
    },
    {
      "period": 1,
      "timestamp": "2026-01-13T00:00:00Z",
      "supply_state": {
        "current_supply": "151630000000000",
        "staked_amount": "75815000000000",
        "stability_committed": "0",
        "m014_state": "INACTIVE",
        "ecological_multiplier_enabled": false
      },
      "burn_amount": "450000000000"
    },
    {
      "period": 2,
      "timestamp": "2026-01-20T00:00:00Z",
      "supply_state": {
        "current_supply": "153261400000000",
        "staked_amount": "76630700000000",
        "stability_committed": "0",
        "m014_state": "INACTIVE",
        "ecological_multiplier_enabled": false
      },
      "burn_amount": "600000000000"
    },
    {
      "period": 3,
      "timestamp": "2026-01-27T00:00:00Z",
      "supply_state": {
        "current_supply": "154693558000000",
        "staked_amount": "77346779000000",
        "stability_committed": "0",
        "m014_state": "INACTIVE",
        "ecological_multiplier_enabled": false
      },
      "burn_amount": "550000000000"
    },
    {
      "period": 4,
      "timestamp": "2026-02-03T00:00:00Z",
      "supply_state": {
        "current_supply": "156133424660000",
        "staked_amount": "78066712330000",
        "stability_committed": "0",
        "m014_state": "INACTIVE",
        "ecological_multiplier_enabled": false
      },
      "burn_amount": "500000000000"
    }
  ]
}
